<?xml version="1.0" encoding="UTF-8"?>
<Resources  xmlns="urn:nonstandard:resources"
     xmlns:xsi="http://www.w3.org/2001/XMLSchema-instance"
     xsi:schemaLocation="urn:nonstandard:resources skin_schema.xsd">

    <spriteset>
        <sprite id="note_bg">
            <frame x="0" y="0" w="204" h="600" file="Note_BG.png" />
        </sprite>
        
        <sprite id="bga10">
            <frame x="0" y="0" w="596" h="558" file="Playing_BG10.png" />
        </sprite>
        <sprite id="bga2">
            <frame x="0" y="0" w="600" h="560" file="Playing_BG2.jpg" />
        </sprite>
        
        <sprite id="dashboard">
            <frame x="0" y="0" w="596" h="42" file="Playing_Menu.png" />
        </sprite>

        <sprite id="pill">
            <frame x="0" y="52" w="28" h="28" file="main.png" />
        </sprite>

        <sprite id="lifebar_bg">
            <frame x="77"  y="1"  w="11" h="301" file="main.png" />
        </sprite>
        <sprite id="lifebar" framespeed="33.3" >
            <frame x="88"  y="1"  w="11" h="301" file="main.png" />
            <frame x="99"  y="1"  w="11" h="301" file="main.png" />
            <frame x="110" y="1"  w="11" h="301" file="main.png" />
            <frame x="121" y="1"  w="11" h="301" file="main.png" />
            <frame x="132" y="1"  w="11" h="301" file="main.png" />
            <frame x="143" y="1"  w="11" h="301" file="main.png" />
            <frame x="154" y="1"  w="11" h="301" file="main.png" />
            <frame x="165" y="1"  w="11" h="301" file="main.png" />
            <frame x="176" y="1"  w="11" h="301" file="main.png" />
            <frame x="187" y="1"  w="11" h="301" file="main.png" />
        </sprite>


        <sprite id="timebar">
            <frame x="0"  y="183"  w="226" h="72" file="font1.png" />
        </sprite>


        <sprite id="judgmentarea" framespeed="5">
            <frame x="224" y="1"  w="192" h="64" file="main.png" />
            <frame x="224" y="66" w="192" h="64" file="main.png" />
        </sprite>

        <sprite id="pressed_note_lane_white">
            <frame x="425" y="1" w="28" h="266" file="main.png" />
        </sprite>

        <sprite id="pressed_note_lane_blue">
            <frame x="455" y="1" w="22" h="480" file="main.png" />
        </sprite>

        <sprite id="pressed_note_lane_yellow">
            <frame x="478" y="1" w="32" h="480" file="main.png" />
        </sprite>

        <sprite framespeed="5" id="measure_mark">
            <frame x="225" y="134" w="188" h="3" file="main.png" />
            <frame x="225" y="138" w="188" h="3" file="main.png" />
        </sprite>

       <sprite framespeed="12" id="head_note_white">
            <frame x="225" y="142" w="28" h="7" file="main.png" />
            <frame x="225" y="150" w="28" h="7" file="main.png" />
            <frame x="225" y="158" w="28" h="7" file="main.png" />
        </sprite>
        
        <sprite framespeed="12" id="body_note_white">
            <frame x="225" y="143" w="28" h="5" file="main.png" />
            <frame x="225" y="151" w="28" h="5" file="main.png" />
            <frame x="225" y="159" w="28" h="5" file="main.png" />
        </sprite>
        <sprite framespeed="12" id="head_note_blue">
            <frame x="254" y="142" w="22" h="7" file="main.png" />
            <frame x="254" y="150" w="22" h="7" file="main.png" />
            <frame x="254" y="158" w="22" h="7" file="main.png" />
        </sprite>
        <sprite framespeed="12" id="body_note_blue">
            <frame x="254" y="143" w="22" h="5" file="main.png" />
            <frame x="254" y="151" w="22" h="5" file="main.png" />
            <frame x="254" y="159" w="22" h="5" file="main.png" />
        </sprite>
        <sprite framespeed="12" id="head_note_yellow">
            <frame x="277" y="142" w="32" h="7" file="main.png" />
            <frame x="277" y="150" w="32" h="7" file="main.png" />
            <frame x="277" y="158" w="32" h="7" file="main.png" />
        </sprite>
        <sprite framespeed="12" id="body_note_yellow">
            <frame x="277" y="143" w="32" h="5" file="main.png" />
            <frame x="277" y="151" w="32" h="5" file="main.png" />
            <frame x="277" y="159" w="32" h="5" file="main.png" />
        </sprite>

        <!-- This overlaps hiding notes underneath -->
        
        <sprite id="static_keyboard">
            <frame x="208" y="366" w="204" h="120" file="main.png" />
        </sprite>

        <sprite id="jam_bar">
            <frame x="1" y="391" w="191" h="12" file="main.png" />
        </sprite>

        <sprite id="pressed_note_keyboard_white1">
            <frame x="1" y="315" w="31" h="46" file="main.png" />
        </sprite>
        <sprite id="pressed_note_keyboard_white2">
            <frame x="1" y="362" w="10" h="5" file="main.png" />
        </sprite>

        <sprite id="pressed_note_keyboard_blue">
            <frame x="33" y="315" w="22" h="42" file="main.png" />
        </sprite>

        <sprite id="pressed_note_keyboard_yellow">
            <frame x="87" y="315" w="32" h="46" file="main.png" />
        </sprite>


        <sprite id="effect_click_1" framespeed="60" alpha="true">
            <frame x="0"    y="0"   w="256" h="256" file="note_click5_3.png" />
            <frame x="256"  y="0"   w="256" h="256" file="note_click5_3.png" />
            <frame x="512"  y="0"   w="256" h="256" file="note_click5_3.png" />
            <frame x="768"  y="0"   w="256" h="256" file="note_click5_3.png" />
            <frame x="1024" y="0"   w="256" h="256" file="note_click5_3.png" />
            <frame x="0"    y="256" w="256" h="256" file="note_click5_3.png" />
            <frame x="256"  y="256" w="256" h="256" file="note_click5_3.png" />
            <frame x="512"  y="256" w="256" h="256" file="note_click5_3.png" />
            <frame x="768"  y="256" w="256" h="256" file="note_click5_3.png" />
            <frame x="1024" y="256" w="256" h="256" file="note_click5_3.png" />
            <frame x="0"    y="512" w="256" h="256" file="note_click5_3.png" />
        </sprite>

        <sprite id="longflare" framespeed="33.3" alpha="true">
            <frame x="0"    y="0"   w="128" h="128" file="longflare.png" />
            <frame x="128"  y="0"   w="128" h="128" file="longflare.png" />
            <frame x="256"  y="0"   w="128" h="128" file="longflare.png" />
            <frame x="384"  y="0"   w="128" h="128" file="longflare.png" />
            <frame x="512"  y="0"   w="128" h="128" file="longflare.png" />
            <frame x="0"    y="128" w="128" h="128" file="longflare.png" />
            <frame x="128"  y="128" w="128" h="128" file="longflare.png" />
            <frame x="256"  y="128" w="128" h="128" file="longflare.png" />
            <frame x="384"  y="128" w="128" h="128" file="longflare.png" />
            <frame x="512"  y="128" w="128" h="128" file="longflare.png" />
            <frame x="0"    y="256" w="128" h="128" file="longflare.png" />
            <frame x="128"  y="256" w="128" h="128" file="longflare.png" />
            <frame x="256"  y="256" w="128" h="128" file="longflare.png" />
            <frame x="384"  y="256" w="128" h="128" file="longflare.png" />
        </sprite>


        <sprite id="combo_number_0" alpha="true">
            <frame x="41" y="27" w="46" h="71" file="numbers_1.png" />
        </sprite>
        <sprite id="combo_number_1" alpha="true">
            <frame x="169" y="27" w="46" h="71" file="numbers_1.png" />
        </sprite>
        <sprite id="combo_number_2" alpha="true">
            <frame x="298" y="27" w="46" h="71" file="numbers_1.png" />
        </sprite>
        <sprite id="combo_number_3" alpha="true">
            <frame x="426" y="27" w="46" h="71" file="numbers_1.png" />
        </sprite>
        <sprite id="combo_number_4" alpha="true">
            <frame x="553" y="27" w="46" h="71" file="numbers_1.png" />
        </sprite>
        <sprite id="combo_number_5" alpha="true">
            <frame x="41" y="155" w="46" h="71" file="numbers_1.png" />
        </sprite>
        <sprite id="combo_number_6" alpha="true">
            <frame x="169" y="155" w="46" h="71" file="numbers_1.png" />
        </sprite>
        <sprite id="combo_number_7" alpha="true">
            <frame x="298" y="155" w="46" h="71" file="numbers_1.png" />
        </sprite>
        <sprite id="combo_number_8" alpha="true">
            <frame x="426" y="155" w="46" h="71" file="numbers_1.png" />
        </sprite>
        <sprite id="combo_number_9" alpha="true">
            <frame x="553" y="155" w="46" h="71" file="numbers_1.png" />
        </sprite>

        <sprite id="combo_title" framespeed="12" alpha="true">
            <frame x="0"   y="0"  w="64" h="64" file="combo_title.png" />
            <frame x="64"  y="0"  w="64" h="64" file="combo_title.png" />
            <frame x="128" y="0"  w="64" h="64" file="combo_title.png" />
            <frame x="0"   y="64" w="64" h="64" file="combo_title.png" />
            <frame x="64"  y="64" w="64" h="64" file="combo_title.png" />
            <frame x="128" y="64" w="64" h="64" file="combo_title.png" />
        </sprite>

        <sprite id="judgment_perfect" alpha="true">
            <frame x="0" y="0" w="128" h="128" file="note_cool_1.png" />
        </sprite>
        <sprite id="judgment_cool" alpha="true">
            <frame x="0" y="0" w="128" h="128" file="note_cool_1.png" />
        </sprite>
        <sprite id="judgment_good" alpha="true">
            <frame x="0" y="0" w="128" h="128" file="note_good_1.png" />
        </sprite>
        <sprite id="judgment_bad" alpha="true">
            <frame x="0" y="0" w="128" h="128" file="note_bad_1.png" />
        </sprite>
        <sprite id="judgment_miss" alpha="true">
            <frame x="0" y="0" w="128" h="128" file="note_miss_1.png" />
        </sprite>

        <!-- Score numbers are from PointNum.ojs, resized and then nicely positioned --> 
        <sprite id="score_number_0">